{
  "country": "xx",
  "law": {
    "name": "Zákon č. 8/2009 Z. z. o cestnej premávke",
    "url": "https://www.slov-lex.sk/ezbierky/pravne-predpisy/SK/ZZ/2009/8/",
    "version": "2026-08-01"
  },
  "speed": {
    "urban": {
      "default": 50,
      "section": "§ 16 ods. 4"
    },
    "rural": {
      "default": 90,
      "section": "§ 16 ods. 2, 3"
    },
    "motorway": {
      "default": 70,
      "hgv": 60,
      "section": "Schedule 6"
    },
    "urban_motorway": {
      "default": 50,
      "section": "§ 16 ods. 4"
    },
    "motorroad": {
      "default": 90,
      "section": "§ 16 ods. 2, 3"
    },
    "urban_motorroad": {
      "default": 50,
      "section": "§ 16 ods. 4"
    },
    "living_street": {
      "default": 20,
      "section": "§ 59 ods. 3"
    }
  },
  "unit": "mph"
}
